{
  "id": "T-0046",
  "exam": "denken2_primary",
  "subject": "機械",
  "topic": "変圧器の最大効率負荷率",
  "format": "numeric",
  "difficulty": 3,
  "params": {
    "iron_loss": {
      "value": 9,
      "unit": "kW",
      "realistic_range": [
        1,
        100
      ]
    },
    "copper_loss": {
      "value": 16,
      "unit": "kW",
      "realistic_range": [
        1,
        100
      ]
    }
  },
  "statement": "変圧器の鉄損 P_i=9kW、全負荷銅損 P_c=16kW である。最大効率を与える負荷率 α は?",
  "answer": "0.75",
  "solution": [
    "銅損は負荷率の2乗に比例: P_c'=α²·P_c。鉄損=銅損 で最大効率",
    "α²·P_c=P_i → α=√(P_i/P_c)=√(9/16)",
    "α=0.75"
  ],
  "validation": {
    "solver_checked": true,
    "human_checked": true,
    "clean_answer": true,
    "physically_valid": true,
    "supervisor_checked": false,
    "confidence": 0.97
  },
  "source": {
    "type": "original",
    "citation": "DENKEN-OS オリジナル問題"
  },
  "stats": {
    "answered": 0,
    "correct_rate": 0
  },
  "status": "validated"
}
